{
  "schema_version": 1,
  "header": {
    "emoji": "🏭",
    "title": "Factory Created: {factory_slug}",
    "subtitle": "Agent factory registered and routes configured"
  },
  "sections": [
    {
      "type": "kv",
      "items": [
        ["Slug", "{factory_slug}"],
        ["Kind", "{factory_kind}"],
        ["Created by", "{actor}"],
        ["Channels", "{channels}"]
      ]
    },
    {
      "type": "text",
      "markdown": "Factory **{factory_slug}** is ready. Use the operator shell to promote with `cortex-factory promote {factory_slug}`."
    }
  ],
  "context": {
    "factory_slug": "{factory_slug}",
    "stage": "created",
    "ts": "{ts}"
  }
}
